web-scraper-order,web-scraper-start-url,title,number,crn,class_cap,credits,professor,schedule,property_1_type,property_1_value,property_2_type,property_2_value,property_3_type,property_3_value,property_4_type,property_4_value,description,programs,programs-href
"1682471342-1208","https://inside.bard.edu/academic/courses/fall2023/menu.htm","Evidence","HR 3206","92069","18","4","Thomas Keenan","Wed  10:10 AM – 12:30 PM Center
  for Curatorial Studies","Distributional","MBV  Meaning, Being, Value  D+J Difference and Justice","Crosslists","Literature;
  Philosophy","null","null","null","null","What can culture and the arts teach us about evidence?
Evidence would seem to be a matter of facts, far from the realm of literary or
artistic invention. But, whether as fact or fiction, we are regularly
confronted by all sorts of signs that (might) bear witness to an occurrence.
When we read the traces of things left behind at this or that scene, of a crime
for instance, questions of interpretation, presentation, even rhetoric, arise
immediately.  Confronted with evidence, we need to make decisions, form conclusions,
reach judgments. This seminar examines various forms of evidence presented in
the context of claims made for human rights and justice. On the basis of the
traces of what is no longer present—whether in the form of statistics, stains,
rubble, graves, documents, photos, videos, social media postings, or
testimony—we have to decide, and risk making claims about the truth of what
happened. This is necessary because evidence can mislead, or even lie, and is
often ignored or suppressed or denied. The complexities of a ‘post-truth’
world, and new modes of political defiance in relation to evidence, make this
even more urgent.  Through many case studies (from the Shoah to police
violence to war crimes to Mediterranean migrant shipwrecks), as well as historical
and theoretical accounts, we will examine the centrality of evidence in
political and ethical disputes today. Readings include texts and projects by
Forensic Architecture, Kate Doyle, Kimberle Crenshaw and Gary Peller, Lawrence
Weschler, Shoshana Felman, Judith Butler, Bruno Latour, Eric Stover, Patrick
Ball, Ariella Azoulay, Georges Didi-Huberman, and others.","Human Rights","https://inside.bard.edu/academic/courses/fall2023/hrp.html"
"1682471342-1209","https://inside.bard.edu/academic/courses/fall2023/menu.htm","Video advocacy: Clemency (Production)","HR 321 A","92067","18","4","Brent Green Thomas Keenan","Tue      12:30 PM
  – 2:50 PM Avery Film Center 338","Distributional","PA  Practicing Arts  D+J Difference and Justice","Crosslists","Experimental Humanities","null","null","null","null","State governors (and the President) in the United States
possess a strange remnant of royal sovereignty: the power of executive
clemency, by which they can pardon offenses or commute the sentences of people
convicted of crimes. They can do this to correct injustices, show mercy, or
undo disproportionate punishments. Clemency doesn’t just happen – it requires a
lot of work on the part of the incarcerated person and his or her advocates.
But there are almost no rules governing what a clemency appeal looks like, so
there is significant room for creativity in how applicants present their cases.
In this practical seminar we will join forces with a team of students at CUNY
Law School and the human rights organization WITNESS to prepare short video
presentations that will accompany a number of New York State clemency
applications this fall. Proficiency with video shooting, editing, and an
independent work ethic are important. Meetings with clemency applicants in
prison are a central element of the class. This is an opportunity to work
collaboratively with law students and faculty, to do hands-on human rights
research and advocacy, and to create work that has real-life impact. The class
will alternate between video production and the study of clemency and pardons,
emotion and human rights, first-person narrative, and persuasion by visual
means. Please submit a short statement describing your abilities in shooting
and editing video, and your interest in criminal justice, by May 6th.
There are no prerequisites, but we seek a class that includes filmmakers,
analysts, and activists.  This is an
Engaged Liberal Arts and Sciences (ELAS) class. Students are strongly
encouraged to take HR 321 B together with this course.","Human Rights","https://inside.bard.edu/academic/courses/fall2023/hrp.html"
"1682471342-1210","https://inside.bard.edu/academic/courses/fall2023/menu.htm","Video advocacy: Clemency (Reading)","HR 321 B","92068","18","2","Brent Green Thomas Keenan","Tue      11:00 AM
  – 12:15 PM Avery Film Center 338","Distributional","PA  Practicing Arts  D+J Difference and Justice","Crosslists","Experimental Humanities","null","null","null","null","This class is a 2-credit
companion to HR 321A, for those students who wish to read additional
scholarly material on clemency, the U.S. criminal justice system, pardons and
forgiveness, the role of images in human rights activism, first-person testimony
and narrative, advocacy, and other related topics.  It does not include a
video production component.  Students in HR 321A are urged to take
it; others are welcome, space permitting.","Human Rights","https://inside.bard.edu/academic/courses/fall2023/hrp.html"
"1682471342-1211","https://inside.bard.edu/academic/courses/fall2023/menu.htm","Illness & Performance","HR 322","92066","5","4","Ziad Abu-Rish","Wed     3:30 PM
  – 5:50 PM Olin 303","Distributional","PA  Practicing Arts  D+J Difference and Justice","Crosslists","Theater
  and Performance","null","null","null","null","“Illness & Performance” explores how the ill body has been
(and currently is) represented in the arts, and interrogates the questions that
arise when an audience encounters art about the ill body. This class will
consider a range of critical and popular texts, as well as creative examples
drawn from performance, theatre and visual art. This class will focus on
several key topics/lenses through which to read work on illness, such as
Illness & Nationalism, Survivorship and Hero Worship, Visible and Invisible
Illness, Narratives of Pandemic, Health Inequality and Activism, Solo
Performance as Metaphor, and will look at illness and its representations
alongside representations of class, gender, sexuality, race and
disability. Central texts include: Audre Lorde’s The Cancer Journals
(1980), Rosemarie Garland Thomson’s Staring: How We Look (2009), Elaine
Scarry’s The Body in Pain (1988), Jo Spence’s Cultural Sniping (1995), Barbara
Ehrenreich’s Bright-Sided (2009), Siddhartha Mukherjee’s Emperor of Maladies
(2010) and many more. Central performances include: Kristina Wong’s
Sweatshop Overlord (2022), Margaret Edson’s Wit (2000), Bryony Kimmings’ I’m a
Phoenix, Bitch (2018), Tony Kushner’s Angels in America (1991), Anna Deavere
Smith’s Let me Down Easy (2009), Adura Onashile’s HeLa (2013) and many more.The
course will be delivered as both discussion seminar and creation lab, with
students completing both a traditional essay on a topic of their choice, and a
short artwork (of any form) which explores the themes studied over the
semester. Courses associated with illness often include difficult
conversations, but the classroom will be both a supportive and brave space to
explore these challenging topics. This course is being offered as the
undergraduate component of a 500/300-level course that combines advanced
undergraduate students and MA students in the Human Rights and the Arts
Program.","Human Rights","https://inside.bard.edu/academic/courses/fall2023/hrp.html"
"1682471342-1212","https://inside.bard.edu/academic/courses/fall2023/menu.htm","Citizens of the World: 
  Ancient, Modern, Contemporary","HR 323","92075","15","4","Thomas Bartscherer","Tue      9:10 AM
  – 11:30 AM OSUN Course","Distributional","MBV  Meaning, Being, Value","null","null","null","null","null","null","“I am a citizen of the world.” First attributed to the Greek philosopher
Diogenes, the concept of “global citizenship” has a complex history and urgent
relevance for the present historical moment. This course explores a tension at
the heart of the idea of global citizenship: the relationship between the
particularity that defines membership in a given cultural and political
community and the universality that characterizes the human condition. Through
the reading of literary and theoretical texts, film screening(s), and
consideration of recent historical events, we will examine the philosophical
and historical development of the concept of global citizenship and its
political, ethical, and psychological implications from antiquity through to
contemporary times. Readings include most if not all of the following: Plato,
Thucydides, Sophocles, Kant, Marx, Arendt, Darwish, Gandhi, Hemon, Coetzee,
Nussbaum, Fukuyama,  and Appiah. This is
an OSUN online course.","Human Rights","https://inside.bard.edu/academic/courses/fall2023/hrp.html"
"1682471342-1213","https://inside.bard.edu/academic/courses/fall2023/menu.htm","Colonial Characters","HR 328","92454","16","4","Zahid Rafiq","Wed     9:10 AM
  – 11:30 AM OSUN Course","Distributional","LA  Literary Analysis in English","null","null","null","null","null","null","What kind of people come to life in occupations, foreign rules,
conflict areas and dictatorships where violence is often the law and no rights
fundamental? Who dies? Who survives? Who flourishes? Who withers away quietly
and who presides over the fate of others? As killings, incarcerations, torture,
enforced disappearances, and even massacres become everyday occurrences, what
happens to people: the fighters, the watchers, the hiders, the betrayers, the
collaborators, the sleepwalkers? Do some people, as Simone Weil says, really
become things? In this course we will read fictional and non-fictional
narratives that grapple from within with violence, subjugation, debasement, and
terror, and yet are testaments to what it means to be human in most terrible
times.  Texts will include writings by
Primo Levi, Svetlana Alexievich, Czeslaw Milosz, Herta Muller, Hassan Blasim,
Chimamanda Adiche, Frantz Fanon, Chinua Achebe, Ramon Valle-Inclan, Varlam
Shamalov,  and others. This is an OSUN
online course.","Human Rights","https://inside.bard.edu/academic/courses/fall2023/hrp.html"
"1682471342-1214","https://inside.bard.edu/academic/courses/fall2023/menu.htm","Reproductive Health and Human Rights","HR 354","92070","20","4","Helen Epstein","Thurs    9:10 AM
  – 11:30 AM OSUN Course","Distributional","SA  Social Analysis  D+J Difference and Justice","Crosslists","Africana
  Studies; Gender and Sexuality Studies; Global & International Studies","null","null","null","null","Centuries ago, a radical shift in attitudes and norms
concerning sexual, reproductive and family life began spreading from one society
to another. Scholars call it the Demographic Transition, narrowly defined as a
progressive reduction in the size of families and an increase in the survival
of children, but its causes and consequences included political turmoil,
personal and romantic upheavals, intellectual and artistic movements, the
spread of diseases like syphilis and AIDS and new ideas about self and
identity.  This Online Open Society
University Network course will explore how individuals, groups and governments
have responded, and continue to respond, to these changes through policy and
social movements related to population, contraception, sexually transmitted
diseases, sex work and sex trafficking, maternal mortality, abortion, gender
violence and other issues.  The course will
draw on case studies from around the world that illustrate both how
discrimination and exclusion worsen reproductive health problems and even
create new ones, and how positive advances in health and rights have come
about.  This is an OSUN online course.","Human Rights","https://inside.bard.edu/academic/courses/fall2023/hrp.html"
"1682471342-1215","https://inside.bard.edu/academic/courses/fall2023/menu.htm","Disability Rights in
  Education","HR 391","92446","18","2","Erin Braselmann","Mon  Wed     3:30
  PM – 4:50 PM Reem Kayden Center 102 (October 30-December
  22)","Distributional","SA Social
  Analysis","null","null","null","null","null","null","This course will introduce students to disability rights and
provide an overview of the different ways to approach disability in the field of
education. Specifically, the course will focus on the history of disability in
the American education system, including a brief history of the disability
rights movement, historical perspectives, advocacy initiatives (such as
Conventions on the Rights of Persons with Disabilities, CRPD; Disability
Rights, Education, Activism, and Mentoring, DREAM, etc.), and the legal
framework (the access it provides and the limitations it produces). Differences
between the medical model and social model of disability, and
institutionalization and deinstitutionalization will be discussed and examined
in the context of educational settings. Disability, as it relates to education,
will be examined from both a civil rights and human rights perspective. The
course will consider the following questions: What is ableism and how does it
appear in education? What is a disability from historical, legal, and
humanistic perspectives? What does it mean to be disabled in America? What does
access in educational settings for disabled students mean? What are the laws
that contribute to access (ADA, Section 504 of the Rehabilitation Act, IDEA,
Fair Housing Act, etc.)? What are educational modifications and “reasonable
accommodations?” Students will learn to think critically about disability in a
variety of contexts and have a greater understanding of the complexities
surrounding disability in education. Students will also develop a deeper
understanding of exclusionary and inclusionary educational practices as well as
inaccessible and accessible educational environments for disabled people.","Human Rights","https://inside.bard.edu/academic/courses/fall2023/hrp.html"
"1682471342-1216","https://inside.bard.edu/academic/courses/fall2023/menu.htm","Senior Project Colloquium","HR 403","92071","20","0","Helen Epstein","Mon       12:30
  PM – 2:50 PM Olin 306","Distributional","SA  Social Analysis","null","null","null","null","null","null","The Senior Project Colloquium is an integral part of the
Human Rights Senior Project and is required of all students.  This course will help you outline the goals of
your project, and provide the support necessary for you to reach them. The
course will cover the process of research and writing including formulating a
viable and provocative research question, mastering relevant research
techniques, identifying sources, gathering materials and outlining an
argument.  Students will present their
work in progress, learn how to critique one another’s writing in a productive
and supportive way, and learn to appreciate the value of research
collaboration.  The colloquium does not
replace regular individual meetings with your faculty advisor.","Human Rights","https://inside.bard.edu/academic/courses/fall2023/hrp.html"
"1682471342-1217","https://inside.bard.edu/academic/courses/fall2023/menu.htm","Socialist Musical Imaginaries","ANTH 209","92013","22","4","Maria Sonevytsky","Tue  Thurs    11:50 AM
  – 1:10 PM Reem Kayden Center 115","Distributional","SA  Social Analysis","Crosslists","Global
  & International Studies; Human Rights; Music; Russian and Eurasian
  Studies","null","null","null","null","","Human Rights","https://inside.bard.edu/academic/courses/fall2023/hrp.html"
"1682471342-1218","https://inside.bard.edu/academic/courses/fall2023/menu.htm","The Rift and the Nile","ANTH 218","92012","22","4","John Ryle","Mon  Wed     10:10 AM
  – 11:30 AM Olin 107","Distributional","SA  Social Analysis  D+J Difference and Justice","Crosslists","Africana
  Studies; Environmental & Urban Studies; Environmental Studies; Historical
  Studies; Human Rights","null","null","null","null","","Human Rights","https://inside.bard.edu/academic/courses/fall2023/hrp.html"
"1682471342-1219","https://inside.bard.edu/academic/courses/fall2023/menu.htm","Anthropology of Food","ANTH 242","92010","22","4","Sucharita Kanjilal","Mon  Wed     3:30 PM
  – 4:50 PM Olin 201","Distributional","SA  Social Analysis  D+J Difference and Justice","Crosslists","Environmental
  & Urban Studies; Environmental Studies; Global & International
  Studies; Human Rights","null","null","null","null","","Human Rights","https://inside.bard.edu/academic/courses/fall2023/hrp.html"
"1682471342-1220","https://inside.bard.edu/academic/courses/fall2023/menu.htm","Global Culture Brokers","ANTH 248","92016","22","4","Laura Kunreuther","Tue  Thurs    10:10 AM
  – 11:30 AM OSUN Course","Distributional","SA  Social Analysis  D+J Difference and Justice","Crosslists","Global
  & International Studies; Human Rights","null","null","null","null","","Human Rights","https://inside.bard.edu/academic/courses/fall2023/hrp.html"
"1682471342-1221","https://inside.bard.edu/academic/courses/fall2023/menu.htm","Contemporary Cultural Theory","ANTH 350","92019","15","4","Jeff Jurgens","Fri   12:30 PM
  – 2:50 PM Hegeman 308","Distributional","SA  Social Analysis  D+J Difference and Justice","Crosslists","Human
  Rights","null","null","null","null","","Human Rights","https://inside.bard.edu/academic/courses/fall2023/hrp.html"
"1682471342-1222","https://inside.bard.edu/academic/courses/fall2023/menu.htm","Dura-Europos and the Problems of Archaeological Archives
  (Part 1)","ARTH 318","91857","10","2","Anne Chen","Wed     9:10 AM
  – 11:30 AM Olin 301","Distributional","AA  Analysis of Art","Crosslists","Classical
  Studies; Experimental Humanities; Human Rights; Middle Eastern Studies","null","null","null","null","","Human Rights","https://inside.bard.edu/academic/courses/fall2023/hrp.html"
"1682471342-1223","https://inside.bard.edu/academic/courses/fall2023/menu.htm","Introduction to Media","ARTS 235","92430","20","4","Joshua Glick","Mon  Wed     3:30 PM
  – 4:50 PM Olin 102","Distributional","AA  Analysis of Art","Crosslists","Human
  Rights; Studio Art","null","null","null","null","","Human Rights","https://inside.bard.edu/academic/courses/fall2023/hrp.html"
"1682471342-1224","https://inside.bard.edu/academic/courses/fall2023/menu.htm","Indigenous Ethno/Musicologies","AS 211","92006","22","4","Luis Chavez","Tue  Thurs    10:10 AM
  – 11:30 AM Reem Kayden Center 102","Distributional","MBV  Meaning, Being, Value","Crosslists","Human
  Rights; Music","null","null","null","null","","Human Rights","https://inside.bard.edu/academic/courses/fall2023/hrp.html"
"1682471342-1225","https://inside.bard.edu/academic/courses/fall2023/menu.htm","Labor Economics","ECON 214","91964","22","4","Michael Martell","Mon  Wed     5:10 PM
  – 6:30 PM Hegeman 102","Distributional","SA  Social Analysis  D+J Difference and Justice","Crosslists","American
  & Indigenous Studies; Gender and Sexuality Studies; Human Rights","null","null","null","null","","Human Rights","https://inside.bard.edu/academic/courses/fall2023/hrp.html"
"1682471342-1226","https://inside.bard.edu/academic/courses/fall2023/menu.htm","Economic Development","ECON 221","91965","22","4","Sanjay DeSilva","Mon  Wed     5:10 PM
  – 6:30 PM Olin 204","Distributional","SA  Social Analysis","Crosslists","Africana
  Studies; Asian Studies; Environmental & Urban Studies; Environmental
  Studies; Global & International Studies; Human Rights; Latin
  American/Iberian Studies; Science, Technology, Society","null","null","null","null","","Human Rights","https://inside.bard.edu/academic/courses/fall2023/hrp.html"
"1682471342-1227","https://inside.bard.edu/academic/courses/fall2023/menu.htm","GIS for Environmental Justice","EUS 321","92026","16","4","Jordan Ayala","Mon  Wed     11:50 AM
  – 1:50 PM Henderson Comp. Center 101A","Distributional","SA  Social Analysis","Crosslists","Architecture;
  Historical Studies; Human Rights","null","null","null","null","","Human Rights","https://inside.bard.edu/academic/courses/fall2023/hrp.html"
"1682471342-1228","https://inside.bard.edu/academic/courses/fall2023/menu.htm","The History of Development since 1945: Global and
  Transnational Histories","GIS 202","92030","22","4","Matthew Shutzer","Mon  Wed     11:50 AM
  – 1:10 PM Reem Kayden Center 115","Distributional","HA  Historical Analysis","Crosslists","Economics;
  Human Rights; Politics","null","null","null","null","","Human Rights","https://inside.bard.edu/academic/courses/fall2023/hrp.html"
"1682471342-1229","https://inside.bard.edu/academic/courses/fall2023/menu.htm","Latin America: Independence, Sovereignty, and Revolution","HIST 152","92033","22","4","Miles Rodriguez","Mon  Wed     10:10 AM
  – 11:30 AM Reem Kayden Center 102","Distributional","HA  Historical Analysis  D+J Difference and Justice","Crosslists","American
  & Indigenous Studies; Global & International Studies; Human Rights;
  Latin American/Iberian Studies","null","null","null","null","","Human Rights","https://inside.bard.edu/academic/courses/fall2023/hrp.html"
"1682471342-1230","https://inside.bard.edu/academic/courses/fall2023/menu.htm","Technology, Labor, Capitalism","HIST 180","92034","22","4","Jeannette Estruth","Tue  Thurs    5:10 PM
  – 6:30 PM Reem Kayden Center 101","Distributional","HA  Historical Analysis  D+J Difference and Justice","Crosslists","American
  & Indigenous Studies; Environmental & Urban Studies; Environmental Studies;
  Experimental Humanities; Human Rights; Science, Technology, Society","null","null","null","null","","Human Rights","https://inside.bard.edu/academic/courses/fall2023/hrp.html"
"1682471342-1231","https://inside.bard.edu/academic/courses/fall2023/menu.htm","The Making of the Modern Middle East","HIST 185","92036","22","4","Ibrahim Elhoudaiby","Mon  Wed     10:10 AM
  – 11:30 AM Olin 204","Distributional","HA  Historical Analysis  D+J Difference and Justice","Crosslists","Global
  & International Studies; Human Rights; Middle Eastern Studies","null","null","null","null","","Human Rights","https://inside.bard.edu/academic/courses/fall2023/hrp.html"
"1682471342-1232","https://inside.bard.edu/academic/courses/fall2023/menu.htm","“Oriental”  Bodies:
  Law, Labor and Gender in the Colonized Middle East","HIST 212","92043","18","4","Ibrahim Elhoudaiby","Mon  Wed     11:50 AM
  – 1:10 PM Olin 303","Distributional","HA  Historical Analysis  D+J Difference and Justice","Crosslists","Global
  & International Studies; Human Rights; Middle Eastern Studies","null","null","null","null","","Human Rights","https://inside.bard.edu/academic/courses/fall2023/hrp.html"
"1682471342-1233","https://inside.bard.edu/academic/courses/fall2023/menu.htm","Resistance and Collaboration in the Holocaust","HIST 2135","92048","22","4","Cecile Kuznitz","Tue  Thurs    1:30 PM
  – 2:50 PM Hegeman 201","Distributional","HA  Historical Analysis  D+J Difference and Justice","Crosslists","German
  Studies; Human Rights; Jewish Studies","null","null","null","null","","Human Rights","https://inside.bard.edu/academic/courses/fall2023/hrp.html"
"1682471342-1234","https://inside.bard.edu/academic/courses/fall2023/menu.htm","Black Modernisms","HIST 2271","92050","15","4","Tabetha Ewing","Wed  Fri   3:30 PM
  – 4:50 PM Olin 305","Distributional","HA  Historical Analysis  D+J Difference and Justice","Crosslists","Africana
  Studies; French Studies; Human Rights","null","null","null","null","","Human Rights","https://inside.bard.edu/academic/courses/fall2023/hrp.html"
"1682471342-1235","https://inside.bard.edu/academic/courses/fall2023/menu.htm","Confucianism: Humanity, Rites, and Rights","HIST 229","92046","22","4","Robert Culp","Mon  Wed     11:50 AM
  – 1:10 PM Reem Kayden Center 101","Distributional","HA  Historical Analysis  D+J Difference and Justice","Crosslists","Asian
  Studies; Human Rights; Study of Religions","null","null","null","null","","Human Rights","https://inside.bard.edu/academic/courses/fall2023/hrp.html"
"1682471342-1236","https://inside.bard.edu/academic/courses/fall2023/menu.htm","Captivity and Law","HIST 310","92053","12","4","Tabetha Ewing","Fri   12:30 PM
  – 2:50 PM Olin Languages Center 208","Distributional","HA  Historical Analysis","Crosslists","Africana
  Studies; Human Rights","null","null","null","null","","Human Rights","https://inside.bard.edu/academic/courses/fall2023/hrp.html"
"1682471342-1237","https://inside.bard.edu/academic/courses/fall2023/menu.htm","Your Papers Please? Technocracy, Technology, and
  Social Control in Nazi Germany, East and West Germany, and the European Union","HIST 3234","92450","12","4","Gregory Moynahan","Tue      12:30 PM
  – 2:50 PM Olin 310","Distributional","HA  Historical Analysis  D+J Difference and
  Justice","Crosslists","German
  Studies; Human Rights; Science, Technology, Society","null","null","null","null","","Human Rights","https://inside.bard.edu/academic/courses/fall2023/hrp.html"
"1682471342-1238","https://inside.bard.edu/academic/courses/fall2023/menu.htm","Latin America: Race, Religion and Revolution","HIST 331","92054","12","4","Miles Rodriguez","Tue  Thurs    11:50 AM
  – 1:10 PM Olin Languages Center 206","Distributional","HA  Historical Analysis  D+J Difference and Justice","Crosslists","Global
  & International Studies; Human Rights; Latin American/Iberian Studies","null","null","null","null","","Human Rights","https://inside.bard.edu/academic/courses/fall2023/hrp.html"
