web-scraper-order,web-scraper-start-url,title,number,crn,class_cap,credits,professor,schedule,property_1_type,property_1_value,property_2_type,property_2_value,property_3_type,property_3_value,property_4_type,property_4_value,description,programs,programs-href
"1682471414-1691","https://inside.bard.edu/academic/courses/fall2023/menu.htm","Poetry Workshop I","WRIT 123 A","92164","14","4","Michael Ives","Tue  Thurs    11:50 AM
  – 1:10 PM Olin 107","Distributional","PA  Practicing Arts","null","null","null","null","null","null","In this course, we’ll approach poems as crafted experiences
that arise out of enmeshed acts of collecting, assembling, shaping, and
dramatizing. Considerable attention will be given to language and silence as
delivery mechanisms—modes of transport into myriad states of feeling,
attending, thinking, and being. Over the course of the term, we’ll sample a
spectrum of poetic forms, voices, structures, and encounters, and learn to
probe them for what they can teach us. Students will be encouraged to extend
their range and sharpen their creative and critical gifts through developing
their ear, and inviting new lexicons, syntactical structures, and tonal
variations to seep into their work. Class will be structured around the
original composition of poetry, supplemented by critical analysis of assigned
poems and texts on poetics, peer critique, in-class writing exercises, and
discussions on creative process. All spaces are reserved for incoming first
year and transfer students. Registration for this class will take place in
August.","Written Arts","https://inside.bard.edu/academic/courses/fall2023/writers.html"
"1682471414-1692","https://inside.bard.edu/academic/courses/fall2023/menu.htm","Poetry Workshop I","WRIT 123 B","92165","14","4","Jenny Xie","Tue  Thurs    11:50 AM
  – 1:10 PM Hegeman 300","Distributional","PA  Practicing Arts","null","null","null","null","null","null","Poetry and poet derive from the ancient Greek term for a
creator, a maker. In this course, we’ll approach poems as crafted
experiences—made pieces—that arise out of enmeshed acts of collecting, assembling,
shaping, and dramatizing. Considerable attention will be given to language and
silence as delivery mechanisms—modes of transport into myriad states of
feeling, attending, thinking, and being. Over the course of the term, we’ll
sample a spectrum of poetic forms, voices, structures, and encounters, and
learn to probe them for they can teach us. Students will be encouraged to
extend their range and sharpen their creative and critical gifts through
developing their ear, and inviting new lexicons, syntactical structures, and
tonal variations to seep into their work. Class will be structured around the
original composition of poetry, supplemented by critical analysis of assigned
poems and texts on poetics, peer critique, in-class writing exercises, and
discussions on creative process. All spaces are reserved for incoming first
year and transfer students. Registration for this class will take place in
August.","Written Arts","https://inside.bard.edu/academic/courses/fall2023/writers.html"
"1682471414-1693","https://inside.bard.edu/academic/courses/fall2023/menu.htm","Poetics of Attention","WRIT 126","92166","14","4","Philip Pardi","Wed     10:10 AM
  – 11:10 AM Hegeman 200","null","Fri   10:10 AM
  – 1:10 PM Olin Languages Center 115","Distributional","PA  Practicing Arts","Crosslists","Experimental
  Humanities","null","null","Whether we train our gaze outward at the world around us or
inward at worlds within, poets are called to pay attention in particular ways.
In this class, we will consider attention as the first step of the creative process,
and we will study and practice the seemingly simple act of attending to all
that we encounter as we move through our days and (on a good day) make poems.
While we will devote some time to revision, the focus of this workshop will be
the fertile ground between immersive experience and early, generative,
exploratory poetic composition. The longer Friday session will be spent writing
together, taking short walks and excursions, sharing our work, and discussing
readings related to the science and practice of attention; the one-hour
Wednesday session will be devoted to a sustained exploration of a single poem.
Special Note: To facilitate our experiment with attentiveness, class meetings
and most of the assignments will occur completely offline (i.e. no phone, no
laptop, no smartwatch). If you have any concerns about this (or any) aspect of
the course format, please contact me before registration. All spaces are
reserved for incoming first year and transfer students. Registration for this
class will take place in August.","Written Arts","https://inside.bard.edu/academic/courses/fall2023/writers.html"
"1682471414-1694","https://inside.bard.edu/academic/courses/fall2023/menu.htm","Risk and the Art of Poetry","WRIT 215","92171","12","4","Dawn Lundy Martin","Mon  Wed     11:50 AM
  – 1:10 PM Olin 309","Distributional","PA  Practicing Arts","null","null","null","null","null","null","We are alive and writing during one of the most fragile times
in most of our lifetimes—a time of plague and war, a time of elevated mass
violence and white supremacist organizing, a time when most of us seek safety, not
risk. Poetry, however, is a way toward thinking through what it means to be
human in any context, whether we can recognize the world as ours or not. It has
the capacity to shift our thinking—about sentence structures, about habitual
patterns of thought, about what might be possible in the future. Poetry helps
us recalibrate the already known so that we may re-see what appears ordinary or
immutable. In this course you’ll generate new poems that push the boundaries of
what you already know about what a poem might be. In creative practice, we’ll
investigate this notion of risk. Readings will include work by Fred Moten,
Fahima Ife, Cecilia Vicuña,  Saidiya
Hartman, Jane Wong, Jerome Ellis, among others.","Written Arts","https://inside.bard.edu/academic/courses/fall2023/writers.html"
"1682471414-1695","https://inside.bard.edu/academic/courses/fall2023/menu.htm","Contemporary Asian American and Asian Diasporic Poetics","WRIT 216","92168","12","4","Jenny Xie","Tue  Thurs    10:10 AM
  – 11:30 AM Hegeman 200","Distributional","PA  Practicing Arts","Crosslists","Asian
  Studies","null","null","null","null","When Aiiieeeee! An Anthology of Asian American Writers
arrived on the U.S. literary scene in 1974, it was both manifesto and
provocation, inflaming still-ongoing debates over the borders, sensibilities, obligations,
and political allegiances of the “Asian American writer.” Since the entrance of
Aiiieeeee and the beginnings of the Asian American Movement in the late 1960’s,
Asian American poetry has expanded to cover vast political and aesthetic
terrain, though knotted questions remain over what designating a work as “Asian
American” allows us to see and understand. 
In this course, we’ll examine the aesthetic heterogeneity and
capaciousness of this slippery category through the lens of contemporary AAPI
and Asian diaspora poets who write in invigoratingly diverse modes, forms,
styles, and visions. How do contemporary AAPI poets innovate poetically to
address evolving concerns of the AAPI community? How do works by these poets
deepen or destabilize our understanding of race and racialization? Course
readings will include the poetry of Nellie Wong, Garrett Hongo, Theresa Cha,
Bhanu Kapil, Rajiv Mohabir, Monica Youn, Vijay Seshadri, Li-Young Lee, Solmaz
Sharif, John Yau, Sarah Howe, Sally Wen Mao, Monica Sok, Hieu Minh Nguyen,
Craig Santos Perez, Timothy Yu, and more. The class will also feature writings
by Anne Anlin Cheng, Viet Thanh Ngyuen, Hua Hsu, and Cathy Park Hong as
critical frameworks for our conversations around race, form, and intersections
between politics and aesthetics. In tandem with the course texts, students will
write their own poetry, and engage in interdisciplinary modes of response. This
course is open to all students with an interest in AAPI poetry and poetics,
along with larger discussions around race and poetic innovation.","Written Arts","https://inside.bard.edu/academic/courses/fall2023/writers.html"
"1682471414-1696","https://inside.bard.edu/academic/courses/fall2023/menu.htm","The Act(s) of Poetry","WRIT 251","92169","12","4","Erica Kaufman","Mon  Wed     3:30 PM
  – 4:50 PM Olin 310","Distributional","PA  Practicing Arts","null","null","null","null","null","null","Poet-critic Lorenzo Thomas begins “How to See Through Poetry:
Myth Perception and History” with the following question: “When is poetry or the
word, itself, action?” Taking our cue from Thomas’s question, this course
focuses on the reading and writing of poetry as an active, investigative
process. Through delving into a myriad of modern and contemporary global
writers (Leslie Scalapino, Eileen Myles, Myung Mi Kim, Harryette Mullen, Serhiy
Zhadan, Mahmoud Darwish, Etel Adnan, CAConrad), and poetic genres (occasional,
documentary, ecological, procedural poetries) we will examine how poetry acts.
What does the form of poetry make possible in our own writing that other
literary genres cannot? What kind of agency and knowledge-making does poetry
enact and invite? Please email a writing sample to kaufman@bard.edu after
registration.","Written Arts","https://inside.bard.edu/academic/courses/fall2023/writers.html"
"1682471414-1697","https://inside.bard.edu/academic/courses/fall2023/menu.htm","Problems of Perspective","WRIT 357","92174","12","4","Dinaw Mengestu","Tue      3:10 PM
  – 5:30 PM Olin 306","Distributional","PA  Practicing Arts  D+J Difference and Justice","Crosslists","Human
  Rights","null","null","null","null","Over the course of this seminar, we will interrogate the
function of perspective in establishing how a narrative, and the characters who
inhabit it, not only see but also interpret the world, and how that perspective
has been used to create distance, both real and imaginary, between an “us” and
a foreign other. We will use our understanding of perspective to look
critically at the world around us, and over the course of the semester will use
a lab model to develop narratives that actively address and engage the world
around us. We will focus on the ethics as well as the aesthetics of narration,
paying close attention to the function of individual words and the narrative
traditions that we are operating within and at times breaking from. The course
will include a lab/workshop component where students will work on developing
and researching topics to address in their writing. Selected readings will
include, but are not limited to Susan Sontag, V.S. Naipaul, Roberto Bolano,
Colson Whitehead, Katherine Boo, Nadine Gordimer, Toni Morrison, F.","Written Arts","https://inside.bard.edu/academic/courses/fall2023/writers.html"
"1682471414-1698","https://inside.bard.edu/academic/courses/fall2023/menu.htm","Toward (A) Moral Fiction","WRIT 369","92172","12","4","Mary Caponegro","Mon       3:10 PM
  – 5:30 PM Reem Kayden Center 200","Distributional","PA  Practicing Arts","Crosslists","Literature","null","null","null","null","The novels in this course each grapple with
ethical issues through fictive means. In navigating them, we will try to assess
the way in which literature can create, complicate, or resolve ethical
dilemmas—or appear to eschew morality altogether. We will also attend to craft,
investigating how these author’s concerns are furthered by formal
considerations. Students will read approximately one novel per week,
occasionally supplemented by theoretical texts. Analytical and creative writing
will allow students to find their own fictive paths to a social, ethical or
political issue as they consider the liabilities of both didacticism and
sensationalism, and explore the role of imagination in the expansiveness of
fiction. The syllabus will likely include the following novels, among others:
Heinrich von Kleist’s Michael Kohlhaas, Kenzaburo Oe’s Nip the Buds
Shoot the Kids, Margaret Atwood’s The Handmaid’s Tale,
Roberto Bolano’s By Night in Chile, Percival Everett’s The Trees,
Elfriede Jelinek’s Wonderful Wonderful Times, J.M.
Coetzee’s Disgrace, NoViolet Bulawayo’s Glory, Miriam Toews’ Women Talking,
Rikki Ducornet’s Netsuke, Atticus Lish’s Preparation for the
Next Life, and Elena Ferrante’s The Lost Daughter.","Written Arts","https://inside.bard.edu/academic/courses/fall2023/writers.html"
"1682471414-1699","https://inside.bard.edu/academic/courses/fall2023/menu.htm","The Will to Change: Resistance & Persuasion in Poetry
  and the Arts","WRIT 370","92176","12","4","Ann Lauterbach","Mon       12:30
  PM – 2:50 PM Olin Languages Center 120","Distributional","PA  Practicing Arts  D+J Difference and Justice","Crosslists","Art
  History and Visual Culture","null","null","null","null","The poet Charles Olson began his 1949 poem “The Kingfishers”
with the line: What does not change/is the will to change. And the critic bell
hooks called her 2004 book The Will to Change: Men, Masculinity and Love. This
class will ask whether creative work can change how we think and act toward
each other and the world. Should the arts provide an escape from reality, a way
to alter it, or both? Can aesthetic choices, and our experience of them,
challenge how we perceive, value and interpret our world?  Do new forms awaken new thoughts and
behaviors? Does the idea of the Beautiful change over time, and is it a valid
means of moral or ethical persuasion? Must a work’s content be polemical in
order to register resistance to the status quo? Does democracy need acts of
imagination in order to thrive?  Ideas
& examples drawn from diverse sources in poetics, philosophy, and art,
possibly including Nietzsche, William James, John Dewey, Hannah Arendt, Helen
Molesworth,  Dave Hickey, Stanley
Cavell,  Mina Loy, John Cage, Samuel
Beckett, George Oppen, Fred Moten, Felix Gonzalez Torres, Cindy Sherman,
Harriette Mullen, Charles Bernstein, Simone White, Leslie Scalapino. Weekly
responses; one term project. Please send the professor a note explaining your
interest in the course prior to registration.","Written Arts","https://inside.bard.edu/academic/courses/fall2023/writers.html"
"1682471414-1700","https://inside.bard.edu/academic/courses/fall2023/menu.htm","Studio in African American Poetry and Poetics","WRIT 371","92177","12","4","Dawn Lundy Martin","Tue      12:30 PM
  – 2:50 PM Reem Kayden Center 200","Distributional","PA  Practicing Arts","Crosslists","Africana
  Studies","null","null","null","null","Studio in African American Poetry and Poetics will be a
course in interdisciplinary making. In this class, we will think and work across
genres, mediums, and disciplines, and collapse the walls between creator and
critic, as we work individually and collaboratively toward new modes of making.
Like innovators in tech, we want to be open and inclusive as we generate new
ideas about what it means to work in the fields of African American poetry and
poetics. This seems especially important in these trying and divisive times. To
this end, we are working toward a practice-based poetics, where creating is
centralized as a way of working through questions to arrive at new ideas.
Collaboration, then, the process of creating in partnership, in community, is
an expression of the practice of poetics at its most dynamic. The course will
also provide students opportunities to attend events, work on archival
projects, and write at the intersections of theory and practice.","Written Arts","https://inside.bard.edu/academic/courses/fall2023/writers.html"
"1682471414-1701","https://inside.bard.edu/academic/courses/fall2023/menu.htm","The Here and Now: Inquiries into the Everyday","WRIT 372","92468","12","4","Jenny Offill","Thur   
  3:10 PM – 5:30 PM Olin 303","Distributional","PA  Practicing Arts","null","null","null","null","null","null","In this course, we will look at a wide variety of literature,
film, and art that concerns itself with the clarification and magnification of particular
moments of being.  An emphasis will be
placed on how these works highlight everyday things that often pass beneath our
notice. In a series of cross-disciplinary projects, we will focus on the small,
the habitual, the overlooked, and discuss how we might transform these
seemingly modest things with the force of our attention. We will discuss why a
specific (and at times mysterious-seeming) choice has been made by a writer or
artist, as well as expanding our conversations to include larger philosophical
questions prompted by these explorations of craft. Topics for discussion will
include the science of attention, the uses of ritual and repetition, “the
discipline of rightness” (as Wallace Stevens once described it), and why
feeling so often precedes form. Readings/viewings will include work by Natalia
Ginzburg, Rainer Marie Rilke, Virginia Woolf, Francis Ponge, Henri Lefebvre,
Teju Cole, Jonathan Crary, Claudia Rankine, Joy Williams, Mierle Laderman
Ukeles, John Cage, Gaston Bachelard and Tehching Hsieh among others. Over the
course of the semester, we will use these texts and artworks as a springboard
for writing our own original texts.","Written Arts","https://inside.bard.edu/academic/courses/fall2023/writers.html"
"1682471414-1702","https://inside.bard.edu/academic/courses/fall2023/menu.htm","Written Arts Senior Colloquium","WRIT 405","92179","30","1",". TBA","Mon       5:40 PM
  – 7:00 PM Reem Kayden Center 103","Distributional","PA  Practicing Arts","null","null","null","null","null","null","The Senior Colloquium in the Written Arts is an important supplement
to the Senior Project. It has several objectives: intellectual/artistic,
social, and vocational. The primary purpose is to guide seniors, both
practically and philosophically, in the daunting task of creating a coherent
and inspired creative work of high quality within a single academic year.
Emphasis is on demystifying the project process, including its bureaucratic
hurdles, as well as exploring the role of research in the creative realm, and
helping students use each other as a critical and inspirational resource during
this protracted solitary endeavor, sharing works in progress when appropriate.
This supplements but never supplants the primary and sacrosanct role of the
project adviser. Program faculty and alumni/ae, career development and other
staff, and outside speakers (such as editors, translators, MFA graduates and
directors, publishing personnel, etc.) contribute their collective wisdom and
experience, sharing the myriad ways in which writers move an idea toward full
creative realization, and giving a glimpse of the kinds of internships and
careers available to the writer. Required for students enrolled in a Written
Arts Senior Project. All such students are enrolled automatically by the
Registrar.","Written Arts","https://inside.bard.edu/academic/courses/fall2023/writers.html"
"1682471414-1703","https://inside.bard.edu/academic/courses/fall2023/menu.htm","Translation, in Theory","LIT 210","92131","22","4","Elizabeth Holt","Tue  Thurs    10:10 AM
  - 11:30 AM Olin 101","Distributional","FL  Foreign Languages and Lit","Crosslists","Written
  Arts","null","null","null","null","","Written Arts","https://inside.bard.edu/academic/courses/fall2023/writers.html"
"1682471414-1704","https://inside.bard.edu/academic/courses/fall2023/menu.htm","Culture and Cultivation","LIT 147","92482","22","4","Elizabeth Holt","Tue  Thurs   
  10:10 AM – 11:30 AM Olin 101","Distributional","LA Literary Analysis in English","Crosslists","Written Arts","null","null","null","null","","Written Arts","https://inside.bard.edu/academic/courses/fall2023/writers.html"
"1682471414-1705","https://inside.bard.edu/academic/courses/fall2023/menu.htm","What is a Character?","LIT 263","92139","22","4","Adhaar Desai","Tue  Thurs    10:10 AM
  - 11:30 AM Albee 106","Distributional","LA  Literary Analysis in English","Crosslists","Experimental
  Humanities; Written Arts","null","null","null","null","","Written Arts","https://inside.bard.edu/academic/courses/fall2023/writers.html"
"1682471416-1706","https://inside.bard.edu/academic/courses/fall2023/menu.htm","Beyond the Work Ethic: The Uses and Misuses of Idleness","LIT 3013","92154","15","4","Marina van Zuylen","Fri   12:30 PM
  – 2:50 PM Olin 301","Distributional","LA  Literary
  Analysis in English","Crosslists","French
  Studies","null","null","null","null","The Useful, Schiller wrote in The Aesthetic Education of Man,
is the great idol of our age.  It
divorces leisure from labor and turns life into a series of utilitarian dead
ends.  Conversely, the impulse to play,
to engage in gratuitous moments of being, in seemingly evanescent
conversations, might be our only chance to convert specialized knowledge into
self-knowledge. Since Socrates, conversation has been admired for its seemless
ability to perform thinking, to integrate knowledge into society, and to
supplement savoir (knowledge) with savoir-vivre (the art of living).  But conversation, precisely because it
clashes with the useful, has often been condemned as merely artful, dangerous
for its proximity to the decadent and the idle.   But what is so threatening about
idleness?  According to Nietzsche,
because idleness leads to self-reflection, we avoid it by mindlessly embracing
work.  The work ethic has become an
excuse for not thinking about the desperate human condition.. Paradoxically,
work has become an escapist diversion and the time to rest and to converse
has  being usurped by the false plenitude
of mechanical labor.  Proust’s In Search of Lost Time adds a new twist to this dichotomy:
for the social-climber, conversation becomes work, a laborious exercise in
appearing rather than being.   This
course examines how these tensions are played both on a rhetorical  (we will read diverse narratological studies
on conversation, studying the use of silences, repetition, dialogue, etc.) and
on a thematic level.  After reading a
selection of critiques of ‘pure’ work (Aristotle, Schiller, Marx, and
Nietzsche), we will examine texts  that expose
the vanity of conversation (Pascal’s Pensées, Molière’s Misanthrope),  novels that thematize the tensions between
work and conversation as social and cultural phenomena  (Henry James, The Europeans, Updike Rabbit
Run), and works that offer up possible aesthetic theories of conversation
(Proust, Swann’s Way and Against Sainte Beuve). 
We will also scrutinize instances where conversation becomes a mere
filler (Beckett’s Waiting for Godot). 
Students will also read Paul Lafargue’s In Praise of Idleness and
Corinne Maier’s Laziness, the recent French bestseller attacking the
dangers of work. This course is a Literature Junior Seminar course.","Junior Seminars","https://inside.bard.edu/academic/courses/fall2023/litseminar.htm"
"1682471416-1707","https://inside.bard.edu/academic/courses/fall2023/menu.htm","Lolita: Nabokov and the Language of Desire","LIT 323","92150","15","4","Olga Voronina","Mon       12:30
  PM – 2:50 PM Olin 307","Distributional","LA  Literary
  Analysis in English","null","null","null","null","null","null","This course invites students to contemplate the legendary
eroticism of Nabokov’s masterwork not only as a matter of plot,
characterization, or dialogue, but also as a linguistic phenomenon. The
aesthetics of sexual desire for Nabokov is inseparable from language – a
physiological, cognitive, and symbolic medium that can affect the reader both
on the level of sound (alliteration, friction, tension, etc.) as well as
through figurative speech, with its multiplicity of connotations and allusions
(hidden messages are like taboos: we desire to break them). Lolita, the novel
we will be reading and re-reading in class, was written in English, which
Nabokov acquired and adopted, rather than being born into. We will investigate
the impact Nabokov’s complicated relationship with the language had on his
writing techniques and stylistic choices. We will also explore strategies of
narrative concealment Nabokov used in order to seduce, mislead, and even
morally blind his readers. Among the texts offered for study and discussion,
there will be Lolita’s prototexts, such as fairy-tales and Arthurian legends;
works by William Shakespeare, Johann Wolfgang von Goethe, Edgar Allan Poe,
Lewis Carroll, and John Ruskin; Russian classical literature (Fyodor
Dostoevsky, Leo Tostoy, Anton Chekhov); German, French, and American pulp
fiction; and the author’s own novels and short stories, either written in
English (Bend Sinister, “A Fairy-Tale”, “Colette”) or self-translated from the
Russian (Laughter in the Dark). This course is a Literature Junior Seminar
course.","Junior Seminars","https://inside.bard.edu/academic/courses/fall2023/litseminar.htm"
